{
  "$schema": "http://json-schema.org/draft-07/schema#",
  "title": "CurriculumVitae Complete Schema",
  "type": "object",
  "properties": {
    "personalInfo": {
      "type": "object",
      "properties": {
        "firstName": { "type": "string" },
        "secondName": { "type": "string" },
        "surname": { "type": "string" },
        "phone": { "type": "string" },
        "email": { "type": "string" },
        "linkedin": { "type": "string" },
        "github": { "type": "string" }
      },
      "required": ["firstName", "surname", "phone", "email"]
    },
    "labels": {
      "type": "object",
      "properties": {
        "aboutMe": { "type": "string" },
        "languages": { "type": "string" },
        "skills": { "type": "string" },
        "softSkills": { "type": "string" },
        "hobbies": { "type": "string" },
        "experience": { "type": "string" },
        "certifications": { "type": "string" },
        "education": { "type": "string" }
      },
      "required": [
        "aboutMe",
        "languages",
        "skills",
        "softSkills",
        "hobbies",
        "experience",
        "certifications",
        "education"
      ]
    },
    "aboutMe": { "type": "string" },
    "languages": {
      "type": "array",
      "items": {
        "type": "object",
        "properties": {
          "name": { "type": "string" },
          "level": { "type": "string" }
        },
        "required": ["name", "level"]
      }
    },
    "hardSkills": {
      "type": "array",
      "items": { "type": "string" }
    },
    "softSkills": {
      "type": "array",
      "items": { "type": "string" }
    },
    "hobbies": {
      "type": "array",
      "items": { "type": "string" }
    },
    "workExperience": {
      "type": "array",
      "items": {
        "type": "object",
        "properties": {
          "company": { "type": "string" },
          "period": { "type": "string" },
          "role": { "type": "string" },
          "techStack": {
            "type": "array",
            "items": { "type": "string" }
          },
          "highlights": {
            "type": "array",
            "items": {
              "type": "object",
              "properties": {
                "title": { "type": "string" },
                "description": { "type": "string" }
              },
              "required": ["title", "description"]
            }
          }
        },
        "required": ["company", "period", "role", "techStack", "highlights"]
      }
    },
    "certifications": {
      "type": "array",
      "items": {
        "type": "object",
        "properties": {
          "title": { "type": "string" },
          "period": {
            "type": "object",
            "properties": {
              "from": { "type": "string" },
              "to": { "type": "string" }
            },
            "required": ["from", "to"]
          }
        },
        "required": ["title", "period"]
      }
    },
    "education": {
      "type": "object",
      "properties": {
        "institution": { "type": "string" },
        "field": { "type": "string" },
        "grade": { "type": "string" },
        "maxGrade": { "type": "string" },
        "degrees": {
          "type": "array",
          "items": {
            "type": "object",
            "properties": {
              "level": { "type": "string" },
              "thesisTitle": { "type": "string" }
            },
            "required": ["level", "thesisTitle"]
          }
        }
      },
      "required": ["institution", "field", "grade", "degrees"]
    },
    "gdprConsent": { "type": "string" }
  },
  "required": [
    "personalInfo",
    "labels",
    "aboutMe",
    "languages",
    "hardSkills",
    "softSkills",
    "hobbies",
    "workExperience",
    "certifications",
    "education"
  ]
}
