{
  "$schema": "./cv.schema.json",
  "personalInfo": {
    "firstName": "Roberto",
    "secondName": "Baldassarre",
    "surname": "Stanziale",
    "phone": "ENV_PHONE",
    "email": "ENV_EMAIL",
    "linkedin": "roberto-stanziale",
    "github": "rstanziale"
  },
  "labels": {
    "aboutMe": "Su di me",
    "languages": "Lingue",
    "skills": "Skill",
    "softSkills": "Soft Skill",
    "hobbies": "Hobby",
    "experience": "Esperienze",
    "certifications": "Certificazioni",
    "education": "Formazione"
  },
  "aboutMe": "Senior Software Engineer specializzato in TypeScript, Angular, Node.js, Java e MongoDB. Filosofia centrale: semplicità pragmatica—previene l'over-engineering per codice pulito, manutenibile e documentazione accessibile. Facilitatore di team e mentore empatico, guida apprendimento continuo ed efficienza onboarding. Conduce R&D interno: Go Onboarding CLI Tool (automatizza health check/Git Flow), TypeScript Workflow Engine (motore open-source paradigmi esecuzione), TypeSpec API Toolkit (scaffolding DX + generazione OpenAPI automatica). Fuori dall'ingegneria: Segretario con funzioni di tesoreria per associazione culturale RUNTS, dirige admin/compliance finanziaria, redige verbali consiglio e bilanci annuali.",
  "languages": [
    {
      "name": "Italiano",
      "level": "madrelingua"
    },
    {
      "name": "Inglese",
      "level": "B2"
    }
  ],
  "hardSkills": [
    "TypeScript / Javascript",
    "HTML / CSS / SCSS",
    "Angular",
    "Java / NodeJS / Go",
    "MongoDB",
    "Git",
    "OOP",
    "Design Pattern"
  ],
  "softSkills": [
    "Empatia",
    "Intraprendenza",
    "Gestione del tempo",
    "Responsabilità",
    "Comunicazione",
    "Voglia di imparare"
  ],
  "hobbies": [
    "Trekking",
    "Finanza personale",
    "Film / Serie TV",
    "Yoga",
    "Lettura libri",
    "Fumetti / Manga"
  ],
  "workExperience": [
    {
      "company": "DEDALUS ITALIA S.p.A.",
      "period": "set 2018 / oggi",
      "role": "Software Engineer",
      "techStack": [
        "TypeScript",
        "Angular",
        "PrimeNG",
        "Bootstrap",
        "Node.js",
        "Java",
        "Vert.x",
        "MongoDB",
        "Docker",
        "OKD",
        "Git",
        "GitHub",
        "Confluence",
        "Jira"
      ],
      "highlights": [
        {
          "title": "Ingegneria Prodotto Core",
          "description": "Guida sviluppo end-to-end suite refertazione Anatomia Patologica; mantiene monorepo Angular, costruisce backend event-driven Vert.x/Node.js/MongoDB per strutture sanitarie."
        },
        {
          "title": "Architettura & Design API",
          "description": "Definisce specifiche tecniche, modelli dati, API REST con Architetto Prodotto; costruisce layer integrazione per sistemi enterprise ospedalieri e aggregazione dati clinici."
        },
        {
          "title": "Integrazione AI & Developer Experience",
          "description": "Implementa flussi AI per automatizzare task dev; adotta TypeSpec per docs API automatiche sostituendo Swagger manuale, migliorando significativamente developer experience."
        },
        {
          "title": "Documentazione & Supporto Delivery",
          "description": "Redige doc funzionali su Confluence/GitHub Wiki; supporta delivery in installazioni/upgrade, riducendo time-to-resolution problematiche."
        },
        {
          "title": "Mentoring, Recruiting & Condivisione",
          "description": "Mentora ingegneri riducendo time-to-autonomy a mesi; conduce interviste tecniche TypeScript/Angular; guida workshop su standard e risultati R&D."
        }
      ]
    }
  ],
  "certifications": [
    {
      "title": "AWS Certified Cloud Practitioner",
      "period": {
        "from": "Novembre 2024",
        "to": "Novembre 2027"
      }
    }
  ],
  "education": {
    "institution": "Università degli studi di Bari \"Aldo Moro\"",
    "field": "Informatica e ingegneria della conoscenza",
    "grade": "105",
    "maxGrade": "110",
    "degrees": [
      {
        "level": "Laurea magistrale",
        "thesisTitle": "Analisi, Progettazione e Sviluppo di un chatbot a supporto di un Holistic Recommender System"
      },
      {
        "level": "Laurea triennale",
        "thesisTitle": "Un sistema di data mining per la sintesi di variabili relazionali nella classificazione di immagini iperspettrali"
      }
    ]
  },
  "gdprConsent": "Autorizzo il trattamento dei miei dati personali presenti nel CV ai sensi del Decreto Legislativo 30 giugno 2003, n. 196 \"Codice in materia di protezione dei dati personali\" e dell'art. 13 del GDPR (Regolamento UE 2016/679)."
}
