{
  "$schema": "./cv.schema.json",
  "personalInfo": {
    "firstName": "Roberto",
    "secondName": "Baldassarre",
    "surname": "Stanziale",
    "phone": "ENV_PHONE",
    "email": "ENV_EMAIL",
    "linkedin": "roberto-stanziale",
    "github": "rstanziale"
  },
  "labels": {
    "aboutMe": "About Me",
    "languages": "Languages",
    "skills": "Skills",
    "softSkills": "Soft Skills",
    "hobbies": "Hobbies",
    "experience": "Work Experience",
    "certifications": "Certifications",
    "education": "Education"
  },
  "aboutMe": "Senior Software Engineer specializing in TypeScript, Angular, Node.js, Java, and MongoDB. Core philosophy: pragmatic simplicity—preventing over-engineering to deliver clean, maintainable code and accessible documentation. Acts as team facilitator and empathetic mentor, driving continuous learning and onboarding efficiency. Leads internal R&D: Go Onboarding CLI Tool (automates health checks/Git Flow), TypeScript Workflow Engine (open-source execution paradigms), TypeSpec API Toolkit (DX scaffolding + automated OpenAPI). Outside engineering: Secretary & Treasurer for RUNTS-registered cultural association, directing admin/financial compliance, authoring board minutes and annual balance sheets.",
  "languages": [
    {
      "name": "Italian",
      "level": "mother tongue"
    },
    {
      "name": "English",
      "level": "B2"
    }
  ],
  "hardSkills": [
    "TypeScript / Javascript",
    "HTML / CSS / SCSS",
    "Angular",
    "Java / NodeJS / Go",
    "MongoDB",
    "Git",
    "OOP",
    "Design Pattern"
  ],
  "softSkills": [
    "Empathy",
    "Intrapreneurship",
    "Time Management",
    "Responsibility",
    "Communication",
    "Continuous Learning"
  ],
  "hobbies": [
    "Trekking",
    "Personal finance",
    "Movies / TV Shows",
    "Yoga",
    "Reading books",
    "Comics / Manga"
  ],
  "workExperience": [
    {
      "company": "DEDALUS ITALIA S.p.A.",
      "period": "Sep 2018 / Present",
      "role": "Software Engineer",
      "techStack": [
        "TypeScript",
        "Angular",
        "PrimeNG",
        "Bootstrap",
        "Node.js",
        "Java",
        "Vert.x",
        "MongoDB",
        "Docker",
        "OKD",
        "Git",
        "GitHub",
        "Confluence",
        "Jira"
      ],
      "highlights": [
        {
          "title": "Core Product Engineering",
          "description": "Lead end-to-end development of Anatomical Pathology reporting suite; maintain Angular monorepo, build event-driven backend with Vert.x/Node.js/MongoDB for healthcare providers."
        },
        {
          "title": "Architecture & API Design",
          "description": "Define technical specs, data models, REST APIs with Product Architect; build integration layers connecting to hospital enterprise systems for clinical data aggregation."
        },
        {
          "title": "AI Integration & Developer Experience",
          "description": "Implement AI flows to automate dev tasks; adopted TypeSpec for automated API docs replacing manual Swagger, significantly boosting developer experience."
        },
        {
          "title": "Documentation & Delivery Support",
          "description": "Author functional docs on Confluence/GitHub Wiki; guide delivery teams through installations/upgrades, reducing issue resolution time."
        },
        {
          "title": "Mentoring, Recruiting & Knowledge Sharing",
          "description": "Mentor engineers reducing time-to-autonomy to months; conduct TypeScript/Angular technical interviews; lead workshops on standards and R&D findings."
        }
      ]
    }
  ],
  "certifications": [
    {
      "title": "AWS Certified Cloud Practitioner",
      "period": {
        "from": "November 2024",
        "to": "November 2027"
      }
    }
  ],
  "education": {
    "institution": "Università degli studi di Bari \"Aldo Moro\"",
    "field": "Computer Science",
    "grade": "105",
    "maxGrade": "110",
    "degrees": [
      {
        "level": "Master's degree",
        "thesisTitle": "Analysis, Design and Development of a chatbot to Support a Holistic Recommender System"
      },
      {
        "level": "Bachelor's degree",
        "thesisTitle": "A data mining system for the synthesis of relational variables in hyperspectral image classification"
      }
    ]
  },
  "gdprConsent": "I authorize the processing of my personal data contained in this CV in accordance with Legislative Decree No. 196 of June 30, 2003 'Personal Data Protection Code' and Article 13 of the GDPR (EU Regulation 2016/679)."
}
